[
  {
    "id": "media:portret-agnes-mulder",
    "url": "/media/portretten/agnes-mulder.jpg",
    "type": "portrait",
    "license": "CC-BY-2.0",
    "credit": "Foto: Sebastiaan ter Burg from Utrecht, The Netherlands, CC-BY-2.0, via Wikimedia Commons",
    "author": "Sebastiaan ter Burg from Utrecht, The Netherlands",
    "source": "src:commons-b36723ca",
    "width": 320,
    "height": 427
  },
  {
    "id": "media:portret-ahlam-oualhadj",
    "url": "/media/portretten/ahlam-oualhadj.jpg",
    "type": "portrait",
    "license": "CC-BY-SA-4.0",
    "credit": "Foto: Photographer: Jan Buteijn, Copyright owner: D66, CC-BY-SA-4.0, via Wikimedia Commons",
    "author": "Photographer: Jan Buteijn, Copyright owner: D66",
    "source": "src:commons-603f2473",
    "width": 320,
    "height": 256
  },
  {
    "id": "media:portret-ahmed-marcouch",
    "url": "/media/portretten/ahmed-marcouch.jpg",
    "type": "portrait",
    "license": "CC-BY-2.0",
    "credit": "Foto: Partij van de Arbeid, CC-BY-2.0, via Wikimedia Commons",
    "author": "Partij van de Arbeid",
    "source": "src:commons-f23ced21",
    "width": 320,
    "height": 480
  },
  {
    "id": "media:portret-alexander-kops",
    "url": "/media/portretten/alexander-kops.png",
    "type": "portrait",
    "license": "CC-BY-3.0",
    "credit": "Foto: Alexander Kops, CC-BY-3.0, via Wikimedia Commons",
    "author": "Alexander Kops",
    "source": "src:commons-35ae6fb4",
    "width": 320,
    "height": 320
  },
  {
    "id": "media:portret-alexander-pechtold",
    "url": "/media/portretten/alexander-pechtold.jpg",
    "type": "portrait",
    "license": "CC-BY-SA-3.0",
    "credit": "Foto: Pepijn Leupen (rights: D66), CC-BY-SA-3.0, via Wikimedia Commons",
    "author": "Pepijn Leupen (rights: D66)",
    "source": "src:commons-f5eb3c9d",
    "width": 320,
    "height": 391
  },
  {
    "id": "media:portret-alida-francis",
    "url": "/media/portretten/alida-francis.jpg",
    "type": "portrait",
    "license": "CC-BY-SA-4.0",
    "credit": "Foto: Masterishn23, CC-BY-SA-4.0, via Wikimedia Commons",
    "author": "Masterishn23",
    "source": "src:commons-236c532d",
    "width": 320,
    "height": 320
  },
  {
    "id": "media:portret-andre-van-de-nadort",
    "url": "/media/portretten/andre-van-de-nadort.jpg",
    "type": "portrait",
    "license": "CC-BY-SA-4.0",
    "credit": "Foto: Lennard Jan Geerts, CC-BY-SA-4.0, via Wikimedia Commons",
    "author": "Lennard Jan Geerts",
    "source": "src:commons-a60d6bdc",
    "width": 320,
    "height": 320
  },
  {
    "id": "media:portret-andries-heidema",
    "url": "/media/portretten/andries-heidema.jpg",
    "type": "portrait",
    "license": "CC0-1.0",
    "credit": "Foto: Apdency, CC0-1.0, via Wikimedia Commons",
    "author": "Apdency",
    "source": "src:commons-a239bcd1",
    "width": 320,
    "height": 383
  },
  {
    "id": "media:portret-anko-postma",
    "url": "/media/portretten/anko-postma.jpg",
    "type": "portrait",
    "license": "CC-BY-SA-4.0",
    "credit": "Foto: WEJ Dekker, CC-BY-SA-4.0, via Wikimedia Commons",
    "author": "WEJ Dekker",
    "source": "src:commons-1f05a7bb",
    "width": 320,
    "height": 213
  },
  {
    "id": "media:portret-anna-sjoukje-van-oosterhout",
    "url": "/media/portretten/anna-sjoukje-van-oosterhout.jpg",
    "type": "portrait",
    "license": "CC-BY-2.0",
    "credit": "Foto: EU2016 NL from The Netherlands, CC-BY-2.0, via Wikimedia Commons",
    "author": "EU2016 NL from The Netherlands",
    "source": "src:commons-859bcfcc",
    "width": 320,
    "height": 352
  },
  {
    "id": "media:portret-annabella-nanninga",
    "url": "/media/portretten/annabella-nanninga.png",
    "type": "portrait",
    "license": "CC-BY-3.0",
    "credit": "Foto: Room for Discussion, CC-BY-3.0, via Wikimedia Commons",
    "author": "Room for Discussion",
    "source": "src:commons-8db9b27e",
    "width": 320,
    "height": 313
  },
  {
    "id": "media:portret-anne-marijke-podt",
    "url": "/media/portretten/anne-marijke-podt.jpg",
    "type": "portrait",
    "license": "CC-BY-2.0",
    "credit": "Foto: Sebastiaan ter Burg from Utrecht, The Netherlands, CC-BY-2.0, via Wikimedia Commons",
    "author": "Sebastiaan ter Burg from Utrecht, The Netherlands",
    "source": "src:commons-5775762a",
    "width": 320,
    "height": 427
  },
  {
    "id": "media:portret-anne-mulder",
    "url": "/media/portretten/anne-mulder.jpg",
    "type": "portrait",
    "license": "CC-BY-3.0",
    "credit": "Foto: Tweede Kamer der Staten-Generaal, CC-BY-3.0, via Wikimedia Commons",
    "author": "Tweede Kamer der Staten-Generaal",
    "source": "src:commons-63d0799f",
    "width": 320,
    "height": 320
  },
  {
    "id": "media:portret-annemiek-van-bolhuis",
    "url": "/media/portretten/annemiek-van-bolhuis.jpg",
    "type": "portrait",
    "license": "CC-BY-4.0",
    "credit": "Foto: IAEA Imagebank, CC-BY-4.0, via Wikimedia Commons",
    "author": "IAEA Imagebank",
    "source": "src:commons-4b64605c",
    "width": 320,
    "height": 213
  },
  {
    "id": "media:portret-annet-bertram",
    "url": "/media/portretten/annet-bertram.jpg",
    "type": "portrait",
    "license": "CC-BY-3.0",
    "credit": "Foto: Tweede Kamer der Staten-Generaal, CC-BY-3.0, via Wikimedia Commons",
    "author": "Tweede Kamer der Staten-Generaal",
    "source": "src:commons-ea782389",
    "width": 320,
    "height": 398
  },
  {
    "id": "media:portret-anno-wietze-hiemstra",
    "url": "/media/portretten/anno-wietze-hiemstra.jpg",
    "type": "portrait",
    "license": "CC-BY-SA-4.0",
    "credit": "Foto: Bé Speelman, CC-BY-SA-4.0, via Wikimedia Commons",
    "author": "Bé Speelman",
    "source": "src:commons-50795097",
    "width": 320,
    "height": 414
  },
  {
    "id": "media:portret-anouschka-naomi-biekman",
    "url": "/media/portretten/anouschka-naomi-biekman.jpg",
    "type": "portrait",
    "license": "CC-BY-SA-4.0",
    "credit": "Foto: Photographer: Jan Buteijn, Copyright owner: D66, CC-BY-SA-4.0, via Wikimedia Commons",
    "author": "Photographer: Jan Buteijn, Copyright owner: D66",
    "source": "src:commons-cbacf233",
    "width": 320,
    "height": 256
  },
  {
    "id": "media:portret-anthony-albertus-hermance-van-campen",
    "url": "/media/portretten/anthony-albertus-hermance-van-campen.jpg",
    "type": "portrait",
    "license": "CC-BY-SA-4.0",
    "credit": "Foto: Ministerie van Buitenlandse Zaken, CC-BY-SA-4.0, via Wikimedia Commons",
    "author": "Ministerie van Buitenlandse Zaken",
    "source": "src:commons-ea0df130",
    "width": 320,
    "height": 427
  },
  {
    "id": "media:portret-antoin-scholten",
    "url": "/media/portretten/antoin-scholten.jpg",
    "type": "portrait",
    "license": "CC-BY-SA-4.0",
    "credit": "Foto: StagiaireMGIMO, CC-BY-SA-4.0, via Wikimedia Commons",
    "author": "StagiaireMGIMO",
    "source": "src:commons-ec70fa67",
    "width": 320,
    "height": 485
  },
  {
    "id": "media:portret-antoine-pierre-cornelis-van-dijck",
    "url": "/media/portretten/antoine-pierre-cornelis-van-dijck.jpg",
    "type": "portrait",
    "license": "CC-BY-3.0",
    "credit": "Foto: Tweede Kamer der Staten-Generaal, CC-BY-3.0, via Wikimedia Commons",
    "author": "Tweede Kamer der Staten-Generaal",
    "source": "src:commons-8964b46d",
    "width": 320,
    "height": 381
  },
  {
    "id": "media:portret-anton-stapelkamp",
    "url": "/media/portretten/anton-stapelkamp.jpg",
    "type": "portrait",
    "license": "CC-BY-3.0",
    "credit": "Foto: Anton Stapelkamp, CC-BY-3.0, via Wikimedia Commons",
    "author": "Anton Stapelkamp",
    "source": "src:commons-5725b559",
    "width": 320,
    "height": 374
  },
  {
    "id": "media:portret-ap-reinders",
    "url": "/media/portretten/ap-reinders.jpg",
    "type": "portrait",
    "license": "CC0-1.0",
    "credit": "Foto: Dassenman, CC0-1.0, via Wikimedia Commons",
    "author": "Dassenman",
    "source": "src:commons-859d562d",
    "width": 320,
    "height": 240
  },
  {
    "id": "media:portret-ard-van-der-tuuk",
    "url": "/media/portretten/ard-van-der-tuuk.jpg",
    "type": "portrait",
    "license": "CC-BY-2.0",
    "credit": "Foto: Lex Draijer, via Partij van de Arbeid Flickr stream, CC-BY-2.0, via Wikimedia Commons",
    "author": "Lex Draijer, via Partij van de Arbeid Flickr stream",
    "source": "src:commons-884b0a73",
    "width": 320,
    "height": 480
  },
  {
    "id": "media:portret-arda-gerkens",
    "url": "/media/portretten/arda-gerkens.jpg",
    "type": "portrait",
    "license": "CC-BY-SA-3.0",
    "credit": "Foto: Govert de Roos / SP, CC-BY-SA-3.0, via Wikimedia Commons",
    "author": "Govert de Roos / SP",
    "source": "src:commons-8e5f388f",
    "width": 320,
    "height": 427
  },
  {
    "id": "media:portret-arjen-gerritsen",
    "url": "/media/portretten/arjen-gerritsen.jpg",
    "type": "portrait",
    "license": "CC-BY-3.0",
    "credit": "Foto: Stichting 900 Jaar De Bilt, CC-BY-3.0, via Wikimedia Commons",
    "author": "Stichting 900 Jaar De Bilt",
    "source": "src:commons-790ab381",
    "width": 320,
    "height": 442
  },
  {
    "id": "media:portret-arjen-maathuis",
    "url": "/media/portretten/arjen-maathuis.jpg",
    "type": "portrait",
    "license": "CC-BY-3.0",
    "credit": "Foto: AAVISIE, CC-BY-3.0, via Wikimedia Commons",
    "author": "AAVISIE",
    "source": "src:commons-4e51d8f6",
    "width": 320,
    "height": 302
  },
  {
    "id": "media:portret-arno-brok",
    "url": "/media/portretten/arno-brok.jpg",
    "type": "portrait",
    "license": "CC-BY-3.0",
    "credit": "Foto: Gemeente Dordrecht / CJW ter Linde, CC-BY-3.0, via Wikimedia Commons",
    "author": "Gemeente Dordrecht / CJW ter Linde",
    "source": "src:commons-35724dc0",
    "width": 320,
    "height": 481
  },
  {
    "id": "media:portret-arthur-van-dijk",
    "url": "/media/portretten/arthur-van-dijk.jpg",
    "type": "portrait",
    "license": "CC-BY-3.0",
    "credit": "Foto: Overal Actueel, CC-BY-3.0, via Wikimedia Commons",